{
  "$schema": "https://json-schema.org/draft/2020-12/schema",
  "$id": "https://waveshed.io/schemas/aether/download_job.schema.json",
  "title": "aether_converter download job",
  "description": "Job consumed by `aether_converter download --job-file <json>`. Authoritative source: crates/aether_converter/src/download.rs (DownloadJob / SubTileSpec).",
  "type": "object",
  "additionalProperties": true,
  "required": [
    "url_template",
    "encoding",
    "output_dir",
    "zoom",
    "tiles"
  ],
  "properties": {
    "url_template": {
      "type": "string",
      "description": "XYZ URL template containing {z}, {x}, {y} placeholders."
    },
    "encoding": {
      "type": "string",
      "enum": [
        "terrarium",
        "mapbox"
      ],
      "description": "Elevation PNG encoding (case-insensitive). Any other value fails at runtime."
    },
    "output_dir": {
      "type": "string",
      "description": "Directory for produced .abt tiles."
    },
    "zoom": {
      "type": "integer",
      "minimum": 0,
      "description": "XYZ zoom level (u32)."
    },
    "max_connections": {
      "type": [
        "integer",
        "null"
      ],
      "minimum": 1,
      "description": "Concurrent HTTP connections. Defaults to 256 when absent. The CLI download runs a fixed pool of this many requests; its window is cut 25 % per second only on >= 3 HTTP 429/503 answers in that second (floor max(max_connections / 4, 16)) and grows 10 % per clean second back to this value; timeouts, resets and slow bodies never move it (CONTRACT 9b, changelog 30). On unix, where even a raised open-file limit cannot hold 2 x max_connections + 96 descriptors, it runs (limit - 96) / 2 connections instead and says so (changelog 36). A full run also holds its output files open, one descriptor each, where they fit beside those; elsewhere each write opens its file and says so (changelog 39)."
    },
    "buildings_pbf_dir": {
      "type": [
        "string",
        "null"
      ],
      "description": "Directory of {z}_{x}_{y}.pbf vector tiles fused onto the finished .abt tiles as a post-pass. All tiles must share one zoom level. Absent means terrain only. With buildings_pbf_ready the post-pass first waits for that marker file (changelog 45)."
    },
    "buildings_pbf_ready": {
      "type": [
        "string",
        "null"
      ],
      "minLength": 1,
      "pattern": "^[^/\\\\]+$",
      "description": "File name inside buildings_pbf_dir (e.g. \"_ready\") whose existence declares the directory complete, so a caller can fetch the building tiles while the job downloads the terrain. With it the CLI download reads nothing in the directory before its buildings post-pass (the directory need not exist at launch); the post-pass first waits for <buildings_pbf_dir>/<buildings_pbf_ready> to exist as a file, looking at once and then every 250 ms for at most buildings_pbf_wait_s. When it has to wait it prints `[Buildings] waiting for the building tiles (<path>)` once and `[Buildings] building tiles ready after <s.s> s` when the marker appears, then burns exactly as a job whose directory was complete at launch (same .abt bytes, same `[Buildings] <n> pbf tile(s)` line). A marker still missing after buildings_pbf_wait_s fails the run (`Building tiles not ready: ...`, exit 1, its .abt files removed) - never a silent run without buildings. Write the marker last, after every tile file is complete; remove a stale one before launching. Requires buildings_pbf_dir; must be one plain file name (no / or \\, not . or ..) and not a {z}_{x}_{y}.pbf/.mvt tile name, else the job fails before any request. Absent or null: unchanged (the post-pass reads the directory as it finds it). CLI download full runs only: repair jobs and the in-memory/WASM downloaders ignore it. Additive, aether_converter >= 0.2.10 (older builds ignore it and burn whatever the directory holds when their terrain is done); CONTRACT 9b, changelog 45."
    },
    "buildings_pbf_wait_s": {
      "type": [
        "number",
        "null"
      ],
      "minimum": 0,
      "maximum": 86400,
      "default": 1800,
      "description": "Seconds the buildings post-pass waits for buildings_pbf_ready, counted from its first look for the marker; absent or null = 1800. Read only together with buildings_pbf_ready (alone it changes nothing); outside 0..86400 the job fails before any request. Additive, aether_converter >= 0.2.10; CONTRACT 9b, changelog 45."
    },
    "tiles": {
      "type": "array",
      "minItems": 1,
      "items": {
        "$ref": "#/$defs/subTileSpec"
      }
    },
    "fetch_bounds": {
      "type": [
        "object",
        "null"
      ],
      "description": "Optional fetch region of interest in degrees. Only source tiles intersecting it are downloaded/decoded; pixels outside keep the -9999 void sentinel. Output grid and .abt layout unchanged. Supported by the in-memory downloader only; the file-based `download` CLI rejects jobs carrying it (its sparse writer would read skipped rows as 0 m).",
      "required": [
        "south",
        "north",
        "west",
        "east"
      ],
      "additionalProperties": true,
      "properties": {
        "south": {
          "type": "number"
        },
        "north": {
          "type": "number"
        },
        "west": {
          "type": "number"
        },
        "east": {
          "type": "number"
        }
      }
    },
    "tile_deadline_s": {
      "type": [
        "number",
        "null"
      ],
      "exclusiveMinimum": 0,
      "maximum": 86400,
      "description": "Per-source-tile wall-clock cap in seconds across all attempts, back-offs and Retry-After waits; absent = 20 (changelog 30; was 60). At expiry the tile is a `timeout` failure and goes to the parent fill. CLI download only. Additive, aether_converter >= 0.2.6 (CONTRACT 9b, changelog 28)."
    },
    "repair_source_tiles": {
      "type": [
        "array",
        "null"
      ],
      "items": {
        "type": "array",
        "prefixItems": [
          {
            "type": "integer",
            "minimum": 0
          },
          {
            "type": "integer",
            "minimum": 0
          },
          {
            "type": "integer",
            "minimum": 0
          }
        ],
        "items": false,
        "minItems": 3,
        "maxItems": 3
      },
      "description": "Source tiles [z, x, y] (z = the job's zoom) to fetch again and patch into the job's EXISTING .abt files; only output pixels wholly determined by listed tiles are rewritten, every other byte is unchanged. Each tile must intersect an output tile and every touched output file must exist, else the run fails before any request. Additive, aether_converter >= 0.2.6 (older builds ignore it and download the whole job); CONTRACT 9b 'Repair jobs', changelog 28."
    },
    "cache_dir": {
      "type": [
        "string",
        "null"
      ],
      "description": "Directory of the raw source-tile cache, shared by every job, service and zoom that names it, and safe for several converter processes at once. Absent, null or empty: no cache (the run is exactly as without the field). Set: every source tile is looked up in <cache_dir>/<service_key>/z<zoom>/x<x>_y<y div 256>.pack before any request (service_key = the first 16 hex digits of SHA-256(url_template, query string included, + newline + lower-cased encoding), so templates that differ only in their query never share a directory; the informational service.json records the template without its query string, so a key in the query never reaches the disk in clear text - one in the path does); a hit is decoded from the cached bytes without a request, and every HTTP 200 body that decoded and every HTTP 404 the run fetches - the parent fill's coarser tiles included - is written there. Since aether_converter 0.2.9 (changelog 40) a tile without an entry is derived without a request from the cached tiles of up to four finer zooms when they cover it (2 x 2 means in the service's encoding, stored with entry status 3; not the service's own coarser tile). Failed, timed-out, undecodable and degraded tiles are never cached. A directory that cannot be used costs one [Warn] line, never the run. CLI download only (a repair job refetches its listed tiles and rewrites their entries); the in-memory and browser downloaders ignore it. .abt bytes, every parsed line and exit codes are unchanged. Additive, aether_converter >= 0.2.8 (older builds ignore it); CONTRACT 9b 'Raw source-tile cache', changelog 38."
    }
  },
  "$defs": {
    "subTileSpec": {
      "type": "object",
      "additionalProperties": true,
      "required": [
        "filename",
        "ul_lat",
        "ul_lon",
        "size_px",
        "resolution_m"
      ],
      "properties": {
        "filename": {
          "type": "string",
          "description": "Output .abt filename within output_dir."
        },
        "ul_lat": {
          "type": "number",
          "description": "Upper-left latitude."
        },
        "ul_lon": {
          "type": "number",
          "description": "Upper-left longitude (east-positive)."
        },
        "size_px": {
          "type": "integer",
          "minimum": 1,
          "description": "Tile side in pixels (u32)."
        },
        "resolution_m": {
          "type": "number",
          "exclusiveMinimum": 0,
          "description": "Metres per pixel; writer sets scale = resolution_m / 111111. XYZ samples are area-averaged over each output pixel's footprint (voids excluded from the mean); where a pixel is finer than the source zoom it takes the sample it sits in. See CONTRACT.md section 6."
        }
      }
    }
  }
}
